[
  { "id": "sbcon-001", "clientId": "client-001", "connectorKey": "bank_mock", "name": "Mock Bank Alpha", "description": "Имитация банковского API", "status": "active", "configJson": {"responseDelayMs": 100, "batchSize": 500, "entityTypes": ["transactions", "accounts"]}, "errorInjectionJson": {"enabled": false, "failureRate": 0, "errorTypes": [], "invalidFieldRate": 0}, "mappingIdsJson": ["sbmap-001", "sbmap-002"], "lastJobId": "sbjob-001", "lastJobAt": "2024-01-25T10:00:00Z", "createdAt": "2024-01-10T10:00:00Z", "updatedAt": "2024-01-25T10:00:00Z" },
  { "id": "sbcon-002", "clientId": "client-001", "connectorKey": "custodian_mock", "name": "Mock Custodian Fidelity", "description": "Имитация кастодиана", "status": "active", "configJson": {"responseDelayMs": 200, "batchSize": 1000, "entityTypes": ["positions", "transactions", "accounts"]}, "errorInjectionJson": {"enabled": false, "failureRate": 0, "errorTypes": [], "invalidFieldRate": 0}, "mappingIdsJson": ["sbmap-003", "sbmap-004"], "lastJobId": "sbjob-005", "lastJobAt": "2024-01-24T15:00:00Z", "createdAt": "2024-01-11T10:00:00Z", "updatedAt": "2024-01-24T15:00:00Z" },
  { "id": "sbcon-003", "clientId": "client-001", "connectorKey": "bill_mock", "name": "Mock Bill Pay Service", "description": "Имитация сервиса платежей", "status": "active", "configJson": {"responseDelayMs": 50, "batchSize": 200, "entityTypes": ["invoices"]}, "errorInjectionJson": {"enabled": true, "failureRate": 5, "errorTypes": ["timeout"], "invalidFieldRate": 2}, "mappingIdsJson": ["sbmap-005"], "lastJobId": "sbjob-010", "lastJobAt": "2024-01-23T12:00:00Z", "createdAt": "2024-01-12T10:00:00Z", "updatedAt": "2024-01-23T12:00:00Z" },
  { "id": "sbcon-004", "clientId": "client-001", "connectorKey": "docvault_mock", "name": "Mock Document Vault", "description": "Имитация хранилища документов", "status": "active", "configJson": {"responseDelayMs": 150, "batchSize": 100, "entityTypes": ["documents"]}, "errorInjectionJson": {"enabled": false, "failureRate": 0, "errorTypes": [], "invalidFieldRate": 0}, "mappingIdsJson": ["sbmap-006"], "lastJobId": "sbjob-012", "lastJobAt": "2024-01-22T09:00:00Z", "createdAt": "2024-01-13T10:00:00Z", "updatedAt": "2024-01-22T09:00:00Z" },
  { "id": "sbcon-005", "clientId": "client-001", "connectorKey": "pricing_mock", "name": "Mock Pricing Feed", "description": "Имитация ценового фида", "status": "active", "configJson": {"responseDelayMs": 30, "batchSize": 5000, "entityTypes": ["prices"]}, "errorInjectionJson": {"enabled": false, "failureRate": 0, "errorTypes": [], "invalidFieldRate": 0}, "mappingIdsJson": ["sbmap-007"], "lastJobId": "sbjob-015", "lastJobAt": "2024-01-25T08:00:00Z", "createdAt": "2024-01-14T10:00:00Z", "updatedAt": "2024-01-25T08:00:00Z" },
  { "id": "sbcon-006", "clientId": "client-001", "connectorKey": "crm_mock", "name": "Mock CRM System", "description": "Имитация CRM", "status": "active", "configJson": {"responseDelayMs": 100, "batchSize": 300, "entityTypes": ["contacts"]}, "errorInjectionJson": {"enabled": false, "failureRate": 0, "errorTypes": [], "invalidFieldRate": 0}, "mappingIdsJson": ["sbmap-008"], "lastJobId": "sbjob-018", "lastJobAt": "2024-01-21T14:00:00Z", "createdAt": "2024-01-15T10:00:00Z", "updatedAt": "2024-01-21T14:00:00Z" },
  { "id": "sbcon-007", "clientId": "client-001", "connectorKey": "accounting_mock", "name": "Mock Accounting GL", "description": "Имитация учетной системы", "status": "active", "configJson": {"responseDelayMs": 200, "batchSize": 1000, "entityTypes": ["transactions", "accounts"]}, "errorInjectionJson": {"enabled": true, "failureRate": 10, "errorTypes": ["validation_error", "timeout"], "invalidFieldRate": 5}, "mappingIdsJson": ["sbmap-009", "sbmap-010"], "lastJobId": "sbjob-020", "lastJobAt": "2024-01-20T16:00:00Z", "createdAt": "2024-01-16T10:00:00Z", "updatedAt": "2024-01-20T16:00:00Z" },
  { "id": "sbcon-008", "clientId": "client-001", "connectorKey": "tax_mock", "name": "Mock Tax Provider", "description": "Имитация налогового провайдера", "status": "paused", "configJson": {"responseDelayMs": 300, "batchSize": 500, "entityTypes": ["tax_lots"]}, "errorInjectionJson": {"enabled": false, "failureRate": 0, "errorTypes": [], "invalidFieldRate": 0}, "mappingIdsJson": ["sbmap-011"], "lastJobId": "sbjob-022", "lastJobAt": "2024-01-18T10:00:00Z", "createdAt": "2024-01-17T10:00:00Z", "updatedAt": "2024-01-18T10:00:00Z" },
  { "id": "sbcon-009", "clientId": "client-001", "connectorKey": "portfolio_mock", "name": "Mock Portfolio System", "description": "Имитация портфельной системы", "status": "active", "configJson": {"responseDelayMs": 150, "batchSize": 800, "entityTypes": ["positions", "transactions"]}, "errorInjectionJson": {"enabled": false, "failureRate": 0, "errorTypes": [], "invalidFieldRate": 0}, "mappingIdsJson": ["sbmap-012", "sbmap-013"], "lastJobId": "sbjob-025", "lastJobAt": "2024-01-24T11:00:00Z", "createdAt": "2024-01-18T10:00:00Z", "updatedAt": "2024-01-24T11:00:00Z" },
  { "id": "sbcon-010", "clientId": "client-001", "connectorKey": "custom_mock", "name": "Custom API Mock", "description": "Пользовательский mock API", "status": "error", "configJson": {"responseDelayMs": 100, "batchSize": 100, "entityTypes": ["transactions"]}, "errorInjectionJson": {"enabled": true, "failureRate": 100, "errorTypes": ["connection_error"], "invalidFieldRate": 0}, "mappingIdsJson": [], "lastJobId": "sbjob-027", "lastJobAt": "2024-01-19T09:00:00Z", "createdAt": "2024-01-19T08:00:00Z", "updatedAt": "2024-01-19T09:00:00Z" }
]
